{
  "schemaVersion": 1,
  "source": {
    "figmaFileKey": "klhs2jMM4MncaJFqZMfqEK",
    "nodeId": "1023:18303",
    "path": "Reader 2/Full/AppearanceContent",
    "revision": "reader2-appearance-20260717"
  },
  "defaults": {
    "dayThemeId": "paper",
    "nightThemeId": "paper-night",
    "fontId": "serif"
  },
  "themes": [
    { "id": "blue", "label": "日间", "scheme": "day", "pairId": "blue-night", "texture": "plain", "swatchHex": "#FFFFFF", "backgroundHex": "#FFFFFF", "inkHex": "#332C25" },
    { "id": "warm", "label": "暖白", "scheme": "day", "pairId": "warm-night", "texture": "plain", "swatchHex": "#FBF0DF", "backgroundHex": "#FBF0DF", "inkHex": "#2C241D" },
    { "id": "blue-night", "label": "夜间", "scheme": "night", "pairId": "blue", "texture": "plain", "swatchHex": "#26231F", "backgroundHex": "#26231F", "inkHex": "#EADFCE" },
    { "id": "warm-night", "label": "暖夜", "scheme": "night", "pairId": "warm", "texture": "plain", "swatchHex": "#302922", "backgroundHex": "#302922", "inkHex": "#EADFCE" },
    { "id": "paper", "label": "纸纹", "scheme": "day", "pairId": "paper-night", "texture": "paper", "swatchHex": "#F5EAD8", "backgroundHex": "#FFF7EC", "inkHex": "#2B241D" },
    { "id": "green", "label": "青叶纹", "scheme": "day", "pairId": "green-night", "texture": "paper", "swatchHex": "#E7F0E2", "backgroundHex": "#EEF5E8", "inkHex": "#263423" },
    { "id": "paper-night", "label": "夜纹", "scheme": "night", "pairId": "paper", "texture": "paper", "swatchHex": "#34302B", "backgroundHex": "#34302B", "inkHex": "#EADFCE" },
    { "id": "green-night", "label": "林夜纹", "scheme": "night", "pairId": "green", "texture": "paper", "swatchHex": "#263129", "backgroundHex": "#263129", "inkHex": "#DBE7D7" }
  ],
  "fonts": [
    { "id": "system", "label": "系统", "familyRole": "system", "webFontStack": "system-ui, -apple-system, BlinkMacSystemFont, \"Segoe UI\", sans-serif", "swiftFamily": "-apple-system", "arktsValue": "system", "importAction": false },
    { "id": "serif", "label": "宋体", "familyRole": "serif", "webFontStack": "var(--fd-serif)", "swiftFamily": "STSongti-SC-Regular", "arktsValue": "serif", "importAction": false },
    { "id": "sans", "label": "黑体", "familyRole": "sans", "webFontStack": "var(--fd-sans)", "swiftFamily": "PingFang SC", "arktsValue": "sans", "importAction": false },
    { "id": "kai", "label": "楷体", "familyRole": "serif", "webFontStack": "\"Kaiti SC\", \"KaiTi\", serif", "swiftFamily": "Kaiti SC", "arktsValue": "kai", "importAction": false },
    { "id": "fangsong", "label": "仿宋", "familyRole": "serif", "webFontStack": "\"FangSong\", \"STFangsong\", serif", "swiftFamily": "STFangsong", "arktsValue": "fangsong", "importAction": false },
    { "id": "mono", "label": "等宽", "familyRole": "mono", "webFontStack": "\"SFMono-Regular\", Consolas, \"Liberation Mono\", monospace", "swiftFamily": "SFMono-Regular", "arktsValue": "mono", "importAction": false },
    { "id": "source-han-serif", "label": "思源宋体", "familyRole": "serif", "webFontStack": "\"Noto Serif SC\", serif", "swiftFamily": "Noto Serif CJK SC", "arktsValue": "sourceSerif", "importAction": false },
    { "id": "lxgw-wenkai", "label": "霞鹜文楷", "familyRole": "serif", "webFontStack": "\"LXGW WenKai\", serif", "swiftFamily": "LXGW WenKai", "arktsValue": "lxgw", "importAction": false },
    { "id": "import", "label": "+ 导入", "familyRole": "import", "webFontStack": "var(--fd-sans)", "swiftFamily": "", "arktsValue": "import", "importAction": true }
  ],
  "selects": [
    { "id": "paragraphIndentMode", "label": "缩进", "defaultValue": "none", "options": [{ "value": "none", "label": "无" }, { "value": "two-character", "label": "2 字符" }] },
    { "id": "textConversion", "label": "简繁", "defaultValue": "simplified", "options": [{ "value": "simplified", "label": "简体" }, { "value": "traditional", "label": "繁体" }] },
    { "id": "pageAnimation", "label": "翻页动画", "defaultValue": "slide", "options": [{ "value": "slide", "label": "平移" }, { "value": "cover", "label": "覆盖" }, { "value": "none", "label": "无" }] },
    { "id": "textAlignment", "label": "文字对齐", "defaultValue": "justify", "options": [{ "value": "justify", "label": "开启" }, { "value": "leading", "label": "关闭" }] }
  ],
  "steppers": [
    { "id": "fontSize", "label": "字号", "unit": "px", "defaultValue": 18, "minimum": 14, "maximum": 26, "step": 1, "precision": 0 },
    { "id": "lineHeight", "label": "行距", "unit": "ratio", "defaultValue": 1.96, "minimum": 1.4, "maximum": 2.4, "step": 0.08, "precision": 2 },
    { "id": "paragraphGap", "label": "段距", "unit": "px", "defaultValue": 16, "minimum": 4, "maximum": 32, "step": 2, "precision": 0 },
    { "id": "letterSpacing", "label": "字距", "unit": "px", "defaultValue": 0, "minimum": 0, "maximum": 2, "step": 0.2, "precision": 1 }
  ]
}
